S. No.,Code,Name ,Type
430,4978,"Udaya School of Engineering, Ammandivilai Post, KanyakumariDistrict 629204",PRIVATE COLLEGES
431,4979,"V P Muthaiah Pillai Meenakshi Ammal Engineering College forWomen, Srivilliputhur Taluk, Virudhunagar District 626190",PRIVATE COLLEGES
432,4980,"Einstein College of Engineering, Seethaparpanallur, TirunelveliDistrict 627012",PRIVATE COLLEGES
433,4981,"Ponjesly College of Engineering, Vettornimadam Post, Nagercoil,Kanyakumari District 629003",PRIVATE COLLEGES
434,4982,"Vins Christian College of Engineering, Chunkankadai Post, Nagercoil,Kanyakumari District 629807",PRIVATE COLLEGES
435,4983,"Lord Jegannath College of Engineering and Technology,Kumarapuram, Thoppur Post, Kanyakumari District 629402",PRIVATE COLLEGES
436,4984,"Marthandam College of Engineering & Technology, Kuttakuzhi,Veeyanoor Post, Kanyakumari District 629177",PRIVATE COLLEGES
437,4989,"P S N Engineering College, Melathediyoor, Tirunelveli District 627152",PRIVATE COLLEGES
438,4992,"Bethlahem Institute of Engineering, Karungal, Kanyakumari District629157",PRIVATE COLLEGES
439,4993,"Loyola Institute of Technology and Science, Loyola Nagar, P B No.2,Thovalai, Kanyakumari District 629302",PRIVATE COLLEGES
440,4994,"J P College of Engineering, College Road, Ayakudy, Tenkasi Taluk,Tenkasi District 627852",PRIVATE COLLEGES
441,4995,"P.S.R.R College of Engineering , Appayanaickenpatti, Sevalpatti,Sivakasi, Virudhunagar-626 140",PRIVATE COLLEGES
442,4996,"Sri Vidhya College of Engineering and Technology, Sivakasi MainRoad, P Kumaralinapuram, Virudhunagar District 626005",PRIVATE COLLEGES
443,4998,"Mahakavi Bharathiyar College of Engineering and Technology,Vasudevanallur, Tenkasi District 627758",PRIVATE COLLEGES
444,4999,"Annai Vailankanni College of Engineering, Pothaiyadi Salai,Pottalkulam, Azhagappapuram, Kanyakumari District 629401",PRIVATE COLLEGES
445,5502,"Sree Raaja Raajan College of Engineering & Technology, AmaravathiVillage, Amaravathi Pudur Post, Karaikudi, Sivagangai District630301",PRIVATE COLLEGES
446,5530,"SSM Institute of Engineering and Technology, Kuttathupatti Village,Sindalaigundu Post, Dindigul District 624002",PRIVATE COLLEGES
447,5532,"Vaigai College of Engineering, Therkutheru, Melur Taluk, MaduraiDistrict 625122",PRIVATE COLLEGES
448,5533,"Karaikudi Institute of Technology, KIT & KIM Technical Campus,Keeranipatti, Thalakkuvur, Karaikudi, Sivagangai District 630307",PRIVATE COLLEGES
449,5536,"Mangayarkarasi College of Engineering, First Street, MangayarkarasiNagar, Paravai, Madurai District 625402",PRIVATE COLLEGES
450,5537,"Jainee College of Engineering and Technology, Dindigul-Theni MainRoad (Near Vakkampatti), Dindigul District 624303",PRIVATE COLLEGES
451,5538,"J.K. College of Architecture, NH-7, Madurai Road, Begampur Post,Dindigul 624002",PRIVATE COLLEGES
452,5703,"Christian College of Engineering and Technology, Oddanchatram,Dindigul District 624619",PRIVATE COLLEGES
453,5720,"Sri Subramanya College of Engineering and Technology,Sukkamanaickanpatti, Palani, Dindigul District 624615",PRIVATE COLLEGES
454,5832,"N P R College of Engineering and Technology, Natham, DindigulDistrict 624003",PRIVATE COLLEGES
455,5842,"Madurai Institute of Engineering & Technology, PottapalayamVillage, Manamadurai Taluk, Sivagangai District 630611",PRIVATE COLLEGES
456,5862,"R V S Educational Trust’s Groups of Institutions (Integrated Campus),N Paraipatti Post, Vedasandur Taluk, Dindigul District 624005",PRIVATE COLLEGES
457,5863,"R V S School of Architecture, N Paraipatti Post, Vedasandur Taluk,Dindigul District 624005",PRIVATE COLLEGES
458,5865,"Nadar Saraswathi College of Engineering and Technology,Vadupudupatti, Annanji Post, Theni District 625531",PRIVATE COLLEGES
459,5902,"Bharath Niketan Engineering College, Thimmarasanaickanoor,Aundipatti, Theni District 625536",PRIVATE COLLEGES
460,5904,"K L N College of Engineering (Autonomous), Pottapalayam,Sivagangai District 630611",PRIVATE COLLEGES
461,5907,"Mohamed Sathak Engineering College, Kilakarai, RamanathapuramDistrict 623806",PRIVATE COLLEGES
462,5910,"P S N A Colllege of Engineering and Technology, Dindigul District624622",PRIVATE COLLEGES
463,5911,"P T R College of Engineering and Technology, Austinpatty Post,Madurai District 625008",PRIVATE COLLEGES
464,5912,"Pandian Saraswathi Yadav Engineering College, Thirumansolai Post,Sivagangai District 630 561",PRIVATE COLLEGES
465,5913,"R V S College of Engineering, N Paraipatti Post, Dindigul District624005",PRIVATE COLLEGES
466,5914,"SOLAMALAI COLLEGE OF ENGINEERIG, Veerapanjan, MaduraiDistrict 625020",PRIVATE COLLEGES
467,5915,"SACS-M A V M M Engineering College, Kidaripatty Post, MaduraiDistrict 625001",PRIVATE COLLEGES
468,5919,"St. Michael College of Engineering and Technology, Kalayarkoil,Sivagangai District 630551",PRIVATE COLLEGES
469,5921,"Syed Ammal Engineering College, Achuthan Vayal Post,Ramanathapuram District 623502",PRIVATE COLLEGES
470,5924,"Ganapathy Chettiar College of Engineering and Technology,Melakavanur Post, Paramakudi, Ramanathapuram District 623706",PRIVATE COLLEGES
471,5930,"SBM College of Engineering and Technology, Thamaraipady, T NParaipatti Pirivu, Dindigul District 624005",PRIVATE COLLEGES
472,5935,"Fatima Michael College of Engineering & Technology, SengottaiVillage, Sivagangai Main Road, Madurai District 625020",PRIVATE COLLEGES
473,5942,"Ultra College of Engineering and Technology, Kodikulam, 1 BitVillage, Madurai-Chennai Highway, Madurai District 625104",PRIVATE COLLEGES
474,5986,"Velammal College of Engineering and Technology, Madurai District625009",PRIVATE COLLEGES
475,5988,"Theni Kammavar Sangam College of Technology, Theni Main Road,Koduvillarpatti Post, Theni District 625534",PRIVATE COLLEGES
476,5990,"Latha Mathavan Engineering College, Kidaripatti Post, Alagarkoil(Via), Melur Taluk, Madurai District 625301",PRIVATE COLLEGES
